{"$schema":"https://schema.hete.io/poa/v1.json","data_constraints":{"canonical_encoding":"JCS","input_schema":"protocol/schemas/transition-request.json","maximum_message_bytes":65536,"maximum_nesting_depth":24},"failure_policy":{"internal_error":"abort","invalid_request":"reject","policy_violation":"reject","quarantine_threshold":3,"repeated_violation":"quarantine"},"mode":"production","network_policy":{"dns_enabled":false,"inbound":[{"address":"127.0.0.1","port":7878,"protocol":"tcp"},{"address":"192.168.1.0/24","port":7878,"protocol":"tcp"}],"outbound":[]},"operations":[{"allowed_actors":["ubuntu-ledger-gateway"],"name":"verify_transition","required_context":["expiry","policy_digest","request_id"]}],"process_constraints":{"lock_after_initialization":true,"os_backend":"openbsd","pledge_promises":["inet","rpath","stdio","wpath"],"unveil_paths":[{"path":"/var/hete/audit","permissions":"rw"},{"path":"/var/hete/policies","permissions":"r"}]},"protocol_id":"hete.verifier.payment","version":"1.0.0"}
